NombreCompleto,Telefono,Mensaje
Antonio Campos,90000000,"¡Hola Antonio Campos!
¿Te gustaría compartir tu experiencia al desembolsar un préstamo en nuestra plataforma? Nos encantaría conocer tu opinión para mejorar nuestros servicios. La entrevista será breve y remota. ¡Tu participación es invaluable! ¿Estás interesado? Responde a este mensaje para coordinar los detalles. Por tu tiempo, te premiaremos con un detalle de parte de nuestro equipo.

Gracias por tu atención,
nombres de equipo
Equipo de UX/UI Design
Préstamos de Consumo Banpas"
